danceability,energy,key,loudness,mode,speechiness,acousticness,instrumentalness,liveness,valence,tempo,type,uri,track_href,analysis_url,duration_ms,time_signature,song_name,artist,album,id,artist_uri,genres,lyrics,popularity,release_date,lyrics_filtered,valence_lyrics,arousal_lyrics,dominance_lyrics
0.224,0.547,5.0,-9.906,0.0,0.042,0.773,0.00305,0.0872,0.291,83.416,audio_features,spotify:track:1wwKY8ICsV9wiCFMpdhPrr,https://api.spotify.com/v1/tracks/1wwKY8ICsV9wiCFMpdhPrr,https://api.spotify.com/v1/audio-analysis/1wwKY8ICsV9wiCFMpdhPrr,273893,1,Colder Heavens,Blanco White,Colder Heavens EP,1wwKY8ICsV9wiCFMpdhPrr,spotify:artist:3ccVtqcqedranb7y8eywJ5,"['british singer-songwriter', 'indie folk']","['In every corridor that shifted the maze\nNo single part of you was ever the same\nNow we’re so tired by the things we have seen\nAll we’ve forgotten only visits in dreams\nHow I misunderstood\nHere I stand undressed\nHere I confess my doubt\nDid you know that I would?\nFrom this fractured lens\nWe’re unveiled again and again\n\nSometimes I get the feeling I’m lost\nJust hiding it is never enough\nNow I find in every mirror a ghost\nOnly once I saw the killer\nOnce I saw the killer up close\nHeaven’s over now\nI know it’s gone\nI know it’s over now\nIf colder heavens come\nCarry me further down\nWhere our madness rests\nWhere I’ll have less to doubt\nAll I misunderstood\nMy abandoned friend\nOur parade has already left…\n\nSometimes I get the feeling I’m lost\nJust hiding it is never enough\nNow I find in every mirror a ghost\nOnly once I saw the killer\nOnce I saw the killer up close\n\nHeaven’s over now, gone away']",58.0,2017-03-31,every corridor shifted maze single part ever we’re tired things seen we’ve forgotten visits dreams misunderstood stand undressed confess doubt know would? fractured lens we’re unveiled sometimes get feeling i’m lost hiding never enough find every mirror ghost saw killer saw killer close heaven’s know it’s gone know it’s colder heavens come carry madness rests i’ll less doubt misunderstood abandoned friend parade already left… sometimes get feeling i’m lost hiding never enough find every mirror ghost saw killer saw killer close heaven’s gone away,2.265178571428572,1.905535714285714,2.3278571428571424
0.45,0.324,2.0,-11.234,1.0,0.037,0.71,0.000679,0.176,0.354,179.133,audio_features,spotify:track:1Bx9I2NyzUpTfmpAQ4BSsR,https://api.spotify.com/v1/tracks/1Bx9I2NyzUpTfmpAQ4BSsR,https://api.spotify.com/v1/audio-analysis/1Bx9I2NyzUpTfmpAQ4BSsR,212027,4,Dream in Blue,The Stray Birds,The Stray Birds,1Bx9I2NyzUpTfmpAQ4BSsR,spotify:artist:6cPMzk1hDgzdIe8vkAhcNM,"['lancaster pa indie', 'new americana', 'progressive bluegrass']","[""I dream in blue\nI drown in dew\nI left home on account of you\nAlways lovin' someone new\nI dream in blue\n\nI gave my time\nDollars and dime\nI left home on account of wine\nMakin' me believe you're mine\nI gave my time\n\nI looked away\nDay after day\nI left home on account of rain\nSlowin' down my glory train\nI looked away\nI've seen those crows\nAll in a row\nI left home on account on snow\nBuried all the things I know\nI've seen those crows\n\nI dream in blue\nI drown in dew\nI left home on account of you\nAlways lovin' someone new\nI dream in blue\n\nI left home on account of you\nAlways lovin' someone new\nI dream in blue\nI dream in blue\nI dream in blue\nI..""]",51.0,2012-07-21,dream blue drown dew left home account always lovin' someone new dream blue gave time dollars dime left home account wine makin' believe mine gave time looked away day day left home account rain slowin' glory train looked away i've seen crows row left home account snow buried things know i've seen crows dream blue drown dew left home account always lovin' someone new dream blue left home account always lovin' someone new dream blue dream blue dream blue i..,3.158285714285714,2.06,2.806
0.642,0.52,9.0,-7.886,1.0,0.0387,0.118,0.000509,0.552,0.488,136.014,audio_features,spotify:track:5CalS8Gn69OOrR9aiw0ZO9,https://api.spotify.com/v1/tracks/5CalS8Gn69OOrR9aiw0ZO9,https://api.spotify.com/v1/audio-analysis/5CalS8Gn69OOrR9aiw0ZO9,196055,4,Honeybee,The Head And The Heart,Living Mirage,5CalS8Gn69OOrR9aiw0ZO9,spotify:artist:0n94vC3S9c3mb2HyNAOcjg,"['folk-pop', 'indie folk', 'modern rock', 'new americana', 'pop rock', 'seattle indie', 'stomp and holler']","[""[Verse 1]\nHoneybee\nCould you imagine where our lives would lead?\nThat silly ring, it wasn't meant to be\nLuckily, you saw in me something I couldn't see\nHoneybee\nI can't imagine how my life would be\nIf all your gravity did not hit me\nOh, don't you see? Darling, my honeybee\n\n[Pre-Chorus]\nBut here we are\nAfter all the messes and confessions\nTo the stars\nThat we never really owned as ours\n[Chorus]\nAnd if our world comes tumbling down\nI never could forgive myself for leaving out\nYou're the one, you are the only one\n\n[Verse 2]\nSuch a fool\nI took your love and I bent all the rules\nYou took the blow and didn't let it show\nStuck around to let me know\nBuilt a family of our own\nLook around\nWe made a garden of the love we found\nSo many reasons I would fight to stay\nYou're the courage when I fade\nTake a look at what we've made\n\n[Pre-Chorus]\nBut here we are\nAfter all the messes and confessions\nTo the scars\nThat we never really owned as ours\n\n[Chorus]\nAnd if our world comes tumbling down\nI never could forgive myself for leaving out\nYou're the one, you are the only one\n\n[Bridge]\nWon't you decide?\nWon't you decide?\nI want you to soar\nDon't doubt anymore\n(Little by little, we'll meet in the middle)\nWon't you decide? (If that's alright)\nWon't you decide?\n(I hope you can hear me, I needed you near me)\nI want you to soar (You save my life)\nDon't doubt anymore (Let's keep this between you and I)\n\n[Pre-Chorus]\nAnd if our world comes tumbling down\nI never could forgive myself for leaving out\n\n[Chorus]\nAnd if our world comes tumbling down\n(If our world comes tumbling down)\nI never could forgive myself for leaving out\n(I never could forgive myself)\nYou're the one, you are the only one\nAnd if our world comes tumbling down\n(The world comes tumbling down)\nI never could forgive myself, I'll say it now\n(I never could forgive myself)\nYou're the one, you are the only one""]",69.0,2019-05-17,honeybee could imagine lives would lead? silly ring meant luckily saw something see honeybee can't imagine life would gravity hit oh see? darling honeybee messes confessions stars never really owned world comes tumbling never could forgive leaving one one fool took love bent rules took blow let show stuck around let know built family look around made garden love found many reasons would fight stay courage fade take look we've made messes confessions scars never really owned world comes tumbling never could forgive leaving one one decide? decide? want soar doubt anymore little little we'll meet middle decide? that's alright decide? hope hear needed near want soar save life doubt anymore let's keep world comes tumbling never could forgive leaving world comes tumbling world comes tumbling never could forgive leaving never could forgive one one world comes tumbling world comes tumbling never could forgive i'll say never could forgive one one,2.9625641025641016,2.0771794871794875,2.7352564102564108
0.579,0.415,7.0,-11.599,1.0,0.0397,0.929,0.0018,0.671,0.42,102.713,audio_features,spotify:track:0TQ8ZHFhrbH9I0WRjIzOCQ,https://api.spotify.com/v1/tracks/0TQ8ZHFhrbH9I0WRjIzOCQ,https://api.spotify.com/v1/audio-analysis/0TQ8ZHFhrbH9I0WRjIzOCQ,219093,4,Nothing Arrived - Live from Spotify London,Villagers,Spotify Sessions,0TQ8ZHFhrbH9I0WRjIzOCQ,spotify:artist:2m1l9MLSslzup4vvokKgvQ,"['chamber pop', 'indie folk', 'indie rock', 'stomp and holler']","[""Savanna scatters and the seabird sings\nSo why should we fear what travel brings?\nWhat were we hoping to get out of this?\nSome kind of momentary bliss?\n\nI waited for something, but something died\nSo I waited for nothing, and nothing arrived\n\nIt's our dearest ally, it's our closest friend\nIt's our darkest blackout, it's our final end\nMy dear sweet nothing, let's start anew\nFrom here on in, it's just me and you\n\nI waited for something, but something died\nSo I waited for nothing, and nothing arrived\nWell I guess it's over, I guess it's begun\nIt's a losers' table, but we've already won\nIt's a funny battle, it's a constant game\nI guess I was busy, when nothing came\n\nI guess I was busy (when nothing arrived)\nI guess I was busy (when nothing arrived)\nI guess I was busy (when nothing arrived)\nI guess I was busy\n\nI waited for something, but something died\nSo I waited for nothing, and nothing arrived\nI waited for something, but something died\nSo I waited for nothing, and nothing arrived nothing arrived""]",65.0,2013-02-18,savanna scatters seabird sings fear travel brings? hoping get this? kind momentary bliss? waited something something died waited nothing nothing arrived dearest ally closest friend darkest blackout final end dear sweet nothing let's start anew waited something something died waited nothing nothing arrived well guess guess begun losers' table we've already funny battle constant game guess busy nothing came guess busy nothing arrived guess busy nothing arrived guess busy nothing arrived guess busy waited something something died waited nothing nothing arrived waited something something died waited nothing nothing arrived nothing arrived,2.49,1.918863636363636,2.3504545454545456
0.761,0.941,6.0,-2.166,1.0,0.0741,0.098,0.0,0.792,0.82,107.021,audio_features,spotify:track:7nJc2Oxfn7xRX3eF4hltyl,https://api.spotify.com/v1/tracks/7nJc2Oxfn7xRX3eF4hltyl,https://api.spotify.com/v1/audio-analysis/7nJc2Oxfn7xRX3eF4hltyl,187320,4,Red Lipstick (feat. Yoonmirae),LeeHi,4 ONLY,7nJc2Oxfn7xRX3eF4hltyl,spotify:artist:7cVZApDoQZpS447nHTsNqu,['k-pop'],[''],60.0,2021-09-09,Error: No lyrics found,0.0,0.0,0.0
