danceability,energy,key,loudness,mode,speechiness,acousticness,instrumentalness,liveness,valence,tempo,type,uri,track_href,analysis_url,duration_ms,time_signature,song_name,artist,album,id,artist_uri,genres,lyrics,popularity,release_date,lyrics_filtered,valence_lyrics,arousal_lyrics,dominance_lyrics
0.583,0.905,2.0,-6.132,1.0,0.0733,0.0984,0.00019,0.0593,0.646,173.982,audio_features,spotify:track:2vz1CsL5WBsbpBcwgboTAw,https://api.spotify.com/v1/tracks/2vz1CsL5WBsbpBcwgboTAw,https://api.spotify.com/v1/audio-analysis/2vz1CsL5WBsbpBcwgboTAw,226827,4,"Footloose - From ""Footloose"" Soundtrack",Various Artists,Footloose (15th Anniversary Collectors' Edition),2vz1CsL5WBsbpBcwgboTAw,spotify:artist:0LyfQWJT6nXafLPZqxe9Of,[],"[""[Verse 1]\nBeen working so hard\nI'm punching my card\nEight hours, for what?\nOh, tell me what I got\nI've got this feeling\nThat time's just holding me down\nI'll hit the ceiling\nOr else I'll tear up this town\n\n[Chorus]\nSo now I gotta cut loose\nFootloose\nKick off the Sunday shoes\nPlease, Louise\nPull me off of my knees\nJack, get back\nCome on before we crack\nLose your blues\nEverybody cut footloose\n[Verse 2]\nYou're playing so cool\nObeying every rule\nDeep way down in your heart\nYou're burning, yearning for some\nSomebody to tell you\nThat life ain't passing you by\nI'm trying to tell you\nIt will if you don't even try\nYou'll gеt by if you'd only\n\n[Chorus]\nCut loose\nFootloose\nKick off the Sunday shoеs\nOoh-wee, Marie\nShake it, shake it for me\nWoah, Milo\nCome on, come on let's go\nLose your blues\nEverybody cut footloose\n\n[Bridge]\nYeah, ooh-oh-oh\n(Cut footloose)\nYeah, ooh-oh-oh\n(Cut footloose)\nYeah, ooh-oh-oh\n(Cut footloose)\nOoh\nFIRST: You've got to turn me around\nSECOND: And put your feet on the ground\nTHIRD: Gotta take the hold of all\nFOUR: I'm turning it loose\n\n[Chorus]\nFootloose\nKick off the Sunday shoes\nPlease, Louise\nPull me off of my knees\nJack, get back\nCome on before we crack\nLose your blues\nEverybody cut footloose\n(Footloose)\n\n[Outro]\nFootloose\n(Footloose)\nKick off the Sunday shoes (C'mon girl)\nPlease, Louise\nPull me off of my knees\nJack, get back\nCome on before we crack\nLose your blues\nEverybody cut, everybody cut\nEverybody cut, everybody cut\nEverybody cut, everybody cut\n(Everybody)\nEverybody cut footloose!""]",72.0,1984,working hard i'm punching card eight hours what? oh tell got i've got feeling time's holding i'll hit ceiling else i'll tear town gotta cut loose footloose kick sunday shoes please louise pull knees jack get back come crack lose blues everybody cut footloose playing cool obeying every rule deep way heart burning yearning somebody tell life ain't passing i'm trying tell even try gеt cut loose footloose kick sunday shoеs ooh-wee marie shake shake woah milo come come let's go lose blues everybody cut footloose yeah ooh-oh-oh cut footloose yeah ooh-oh-oh cut footloose yeah ooh-oh-oh cut footloose ooh first: got turn around second: put feet ground third: gotta take hold four: i'm turning loose footloose kick sunday shoes please louise pull knees jack get back come crack lose blues everybody cut footloose footloose footloose footloose kick sunday shoes c'mon girl please louise pull knees jack get back come crack lose blues everybody cut everybody cut everybody cut everybody cut everybody cut everybody cut everybody everybody cut footloose!,2.2432142857142856,1.7739285714285715,2.322142857142857
0.508,0.807,11.0,-8.581,1.0,0.0686,0.333,0.00363,0.136,0.306,123.034,audio_features,spotify:track:4BUtvtGTRvJB49Hx2F7lle,https://api.spotify.com/v1/tracks/4BUtvtGTRvJB49Hx2F7lle,https://api.spotify.com/v1/audio-analysis/4BUtvtGTRvJB49Hx2F7lle,251667,4,Marchin On,OneRepublic,Waking Up,4BUtvtGTRvJB49Hx2F7lle,spotify:artist:5Pwc4xIPtQLFEnJriah9YJ,"['dance pop', 'piano rock', 'pop', 'pop rock']","[""[Verse 1]\nFor those days we felt like a mistake\nThose times when loves what you hate\nSomehow\nWe keep marchin' on\nFor those nights when I couldn't be there\nI've made it harder to know that you know\nThat somehow\nWe'll keep moving on\n\n[Pre-Chorus]\nThere's so many wars we fought\nThere's so many things we're not\nBut with what we have\nI promise you that\nWe're marchin' on\nWe're marchin' on\nWe're marchin' on\n[Chorus 1]\nFor all of the plans we've made\nThere isn't a flag I'd wave\nDon't care if we bend\nI'd sink us to swim\nWe're marchin' on\nWe're marchin' on\nWe're marchin' on\n\n[Verse 2]\nFor those doubts that swirl all around us\nFor those lives that tear at the seams\nWe know\nWe're not what we've seen, oh\nFor this dance we'll move with each other\nThere ain't no other step than one foot\nRight in front of the other\n\n[Pre-Chorus]\nThere's so many wars we fought\nThere's so many things we're not\nBut with what we have\nI promise you that\nWe're marchin' on\nWe're marchin' on\nWe're marchin' on\n\n[Chorus 1]\nFor all of the plans we've made\nThere isn't a flag I'd wave\nDon't care if we bend\nI'd sink us to swim\nWe're marchin' on\nWe're marchin' on\nWe're marchin' on\n\n[Chorus 2]\nRight, right, right, right, left, right\nRight, right, right, right, left, right\nRight, right\nWe're marchin' on\n\n[Bridge]\nWe'll have the days we break\nAnd we'll have the scars to prove it\nWe'll have the bonds that we save\nBut we'll have the heart not to lose it\nFor all of the times we've stopped\nFor all of the things I'm not\nWe put one foot in front of the other\nWe move like we ain't got no other\nWe go when we go\nWe're marchin' on\nWe're marchin' on\n\n[Pre-Chorus]\nThere's so many wars we fought\nThere's so many things we're not\nBut with what we have\nI promise you that\nWe're marchin' on\nWe're marchin' on\nWe're marchin' on\n\n[Chorus 2]\nRight, right, right, right, left, right\nRight, right, right, right, left, right\nRight, right\nWe're marchin' on\nWe're marchin' on\nWe're marchin' on\nRight, right, right, right, left, right\nRight, right, right, right, left, right\nRight, right\nWe're marchin' on""]",55.0,2009-01-01,days felt like mistake times loves hate somehow keep marchin' nights i've made harder know know somehow we'll keep moving there's many wars fought there's many things we're promise we're marchin' we're marchin' we're marchin' [chorus 1] plans we've made flag i'd wave care bend i'd sink us swim we're marchin' we're marchin' we're marchin' doubts swirl around us lives tear seams know we're we've seen oh dance we'll move ain't step one foot right front there's many wars fought there's many things we're promise we're marchin' we're marchin' we're marchin' [chorus 1] plans we've made flag i'd wave care bend i'd sink us swim we're marchin' we're marchin' we're marchin' [chorus 2] right right right right left right right right right right left right right right we're marchin' we'll days break we'll scars prove we'll bonds save we'll heart lose times we've stopped things i'm put one foot front move like ain't got go go we're marchin' we're marchin' there's many wars fought there's many things we're promise we're marchin' we're marchin' we're marchin' [chorus 2] right right right right left right right right right right left right right right we're marchin' we're marchin' we're marchin' right right right right left right right right right right left right right right we're marchin',2.4395454545454545,1.801818181818181,2.398333333333333
0.834,0.472,5.0,-7.777,0.0,0.0873,0.412,6.76e-05,0.0836,0.517,107.014,audio_features,spotify:track:52Qu0no0NBho3zyRmjlsHn,https://api.spotify.com/v1/tracks/52Qu0no0NBho3zyRmjlsHn,https://api.spotify.com/v1/audio-analysis/52Qu0no0NBho3zyRmjlsHn,244747,4,Another Sad Love Song,Khalid,American Teen,52Qu0no0NBho3zyRmjlsHn,spotify:artist:6LuN9FCkKOj5PcnpouEgny,"['pop', 'pop r&b']","[""[Verse 1]\nI'm not the best at showing my emotions\nYou cut me deep and you left me wide open\nI fought the demons that lie in between us\nThey'd think we're perfect if they'd ever seen us, but\nI guess this sounds like another sad love song\nI can't get over how it all went wrong\nBut, I let the words come together\nThen, maybe I'll feel better\n\n[Chorus]\nBridges they are burning\nLover, I am worried\nTables they are turning\nLover, I am hurting\nBurning burning burning, dadadadada\nTurning turning turning turning, dadadadada\nBurning burning burning, dadadadada\nTurning turning turning turning, dadadadada\n[Verse 2]\nI took the time to think of what you said\nYou were tap-dancing in my head\nI must be honest, I have a lot of pride\nBut I'm broken inside\nI guess this sounds like another sad love song\nI can't get over how it all went wrong\nBut, I let the words come together\nThen, maybe I'll feel better\n\n[Chorus]\nBridges they are burning\nLover, I am worried\nTables they are turning\nLover, I am hurting\nBridges they are burning\nLover, I am worried\nTables they are turning\nLover, I am hurting\nBurning burning burning, dadadadada\nTurning turning turning turning, dadadadada\nBurning burning burning, dadadadada\nTurning turning turning turning, dadadadada\nBurning burning burning, dadadadada\nTurning turning turning turning, dadadadada\nBurning burning burning, dadadadada\nTurning turning turning turning, dadadadada\nBridges they are burning\nLover, I am worried\nTables they are turning\nLover, I am hurting\nBridges they are burning\nLover, I am worried\nTables they are turning\nLover, I am hurting""]",67.0,2017-04-27,i'm best showing emotions cut deep left wide open fought demons lie us they'd think we're perfect they'd ever seen us guess sounds like another sad love song can't get went wrong let words come together maybe i'll feel better bridges burning lover worried tables turning lover hurting burning burning burning dadadadada turning turning turning turning dadadadada burning burning burning dadadadada turning turning turning turning dadadadada took time think said tap-dancing head must honest lot pride i'm broken inside guess sounds like another sad love song can't get went wrong let words come together maybe i'll feel better bridges burning lover worried tables turning lover hurting bridges burning lover worried tables turning lover hurting burning burning burning dadadadada turning turning turning turning dadadadada burning burning burning dadadadada turning turning turning turning dadadadada burning burning burning dadadadada turning turning turning turning dadadadada burning burning burning dadadadada turning turning turning turning dadadadada bridges burning lover worried tables turning lover hurting bridges burning lover worried tables turning lover hurting,2.4466666666666663,1.9357894736842105,2.3833333333333337
0.741,0.894,4.0,-3.826,1.0,0.0496,0.0814,0.0527,0.089,0.96,114.879,audio_features,spotify:track:2Cy7QY8HPLk925AyNAt6OG,https://api.spotify.com/v1/tracks/2Cy7QY8HPLk925AyNAt6OG,https://api.spotify.com/v1/audio-analysis/2Cy7QY8HPLk925AyNAt6OG,202853,4,Black or White - Single Version,Michael Jackson,The Essential Michael Jackson,2Cy7QY8HPLk925AyNAt6OG,spotify:artist:3fMbdgg4jU18AjLCKBhRSm,"['pop', 'r&b', 'soul']","[""[Skit: Father &amp; Son]\nHey!\nWhat?\nTurn that off!\nDad, this is the best part!\nTurn it off!\nNo!\nIt’s too late for this, turn it off!\nDad, this is the best part, come on!\nNo, turn it off now!\nNo, this is the, I want to listen to it, okay?\nYou’ve got things to do tomorrow\nYeah, right. Too late. Sure. Eat this\n\n[Intro: Michael Jackson]\nAaow!\nAaow!\n[Verse 1: Michael Jackson]\nI took my baby on a Saturday bang\nBoy, is that girl with you?\nYes, we're one and the same\nNow, I believe in miracles\nAnd a miracle has happened tonight\nHee!\n\n[Chorus: Michael Jackson]\nBut, if you're thinking about my baby\nIt don't matter if you're black or white\nOoh!\n\n[Verse 2: Michael Jackson]\nThey print my message in the Saturday sun\nI had to tell 'em I ain't second to none\nAnd I told 'em about equality\nAnd it's true, either you're wrong or you're right\nHoo!\n\n[Chorus: Michael Jackson]\nBut, if you're thinking about my baby\nIt don't matter if you're black or white\nHoo!\nGone withca girl!\nHee-hee!\n\n[Bridge: Michael Jackson]\nI am tired of this devil\nI am tired of this stuff\nI am tired of this business\nSo when the going gets rough\nI ain't scared of your brother\nI ain't scared of no sheets\nI ain't scared of nobody\nGirl, when the going gets mean\n\n[Rap: L.T.B.]\nProtection for gangs, clubs and nations\nCausing grief in human relations\nIt's a turf war on a global scale\nI'd rather hear both sides of the tale\nSee, it's not about races\nJust places, faces\nWhere your blood comes from is where your space is\nI've seen the bright get duller\nI'm not going to spend my life being a color\n\n[Verse 3: Michael Jackson]\nDon't tell me you agree with me\nWhen I saw you kicking dirt in my eye\nHee-hee!\n\n[Chorus: Michael Jackson]\nBut, if you're thinking about my baby\nIt don't matter if you're black or white\nI said if you're thinking of being my baby\nIt don't matter if you're black or white\nI said if you're thinking of being my brother\nIt don't matter if you're black or white\n\n[Outro: Michael Jackson]\nAlright, alright\nAh, dah, ah (Ooh, ooh, ooh, ooh)\nDah, ah, dah, alright\nOoh, ooh, yeah, yeah, yeah, now\nAlright, alright (Ooh, ooh, ooh, ooh)\nShamone, don't\nOoh, ooh, yeah, yeah, yeah now\nAlright (Ooh, ooh, ooh, ooh)\nIt's black, it's white\nIt's tough for you to get by (Ooh, ooh, yeah, yeah, yeah)\nIt's black, it's white, hoo! (Ooh, ooh, ooh, ooh)\nIt's black, it's white\nIt's tough for you to get by (Ooh, ooh, yeah, yeah, yeah)\nIt's black, it's white, hoo! (Shamone, dah)""]",64.0,2005-07-19,[skit: father &amp; son] hey! what? turn off! dad best part! turn off! no! it’s late turn off! dad best part come on! turn now! want listen okay? you’ve got things tomorrow yeah right. late. sure. eat aaow! aaow! took baby saturday bang boy girl you? yes we're one believe miracles miracle happened tonight hee! thinking baby matter black white ooh! print message saturday sun tell 'em ain't second none told 'em equality true either wrong right hoo! thinking baby matter black white hoo! gone withca girl! hee-hee! tired devil tired stuff tired business going gets rough ain't scared brother ain't scared sheets ain't scared nobody girl going gets mean [rap: l.t.b.] protection gangs clubs nations causing grief human relations turf war global scale i'd rather hear sides tale see races places faces blood comes space i've seen bright get duller i'm going spend life color tell agree saw kicking dirt eye hee-hee! thinking baby matter black white said thinking baby matter black white said thinking brother matter black white alright alright ah dah ah ooh ooh ooh ooh dah ah dah alright ooh ooh yeah yeah yeah alright alright ooh ooh ooh ooh shamone ooh ooh yeah yeah yeah alright ooh ooh ooh ooh black white tough get ooh ooh yeah yeah yeah black white hoo! ooh ooh ooh ooh black white tough get ooh ooh yeah yeah yeah black white hoo! shamone dah,2.4422307692307696,1.8664615384615384,2.379
0.913,0.579,1.0,-8.693,1.0,0.243,0.258,6.75e-05,0.124,0.433,143.009,audio_features,spotify:track:6FLnfJ4focrSUvYplO5k4D,https://api.spotify.com/v1/tracks/6FLnfJ4focrSUvYplO5k4D,https://api.spotify.com/v1/audio-analysis/6FLnfJ4focrSUvYplO5k4D,217850,4,Of Course,Headie One,Of Course,6FLnfJ4focrSUvYplO5k4D,spotify:artist:6UCQYrcJ6wab6gnQ89OJFh,['uk hip hop'],"[""[Intro]\nM1OnTheBeat\nM1OnTheBeat\n\n[Verse 1]\nBro just beat a next AM\nHe ain't tell me, that’s normal\nStep with the metal, that's daily\nIt won't fail me, that’s bro-bro\nOn the opp block we took selfies\nOur presence, it was known of\nNow they don't even know it's us when we get on that scoreboard\nBack hand grip with my black blade\nChing mans head, leave that more than swollen\nI'm in station like 5am\nBeen like five AM's and not once mans spoken\nHow many times have the gangdem denied them splashings\nLike five in the morning?\nIt's the crack of dawn, I barely know where I am\nAnd I'm still yawnin'\nReally do them things that we talk of\nThe gang ain’t fall off\nStill pree that 4 .44 long\nNuttin’ but the baddest of B's\nCats, fiends, plugs in my call log\nI step with the ah, nearly as long as me\nI don’t even care if it's sawn-off\nTracksuit, no chinos, no polos\nFeds want me in the system, no solar\nBad B in the visit hall, I'm like 'oh lard’\nAgain I got a boner\nShe wanna know what day I come home on\nI know what it feels like to go back and forth with my lawyer\nCah he tell me what day I got court on\nI don't know that opp or what road he got caught on\nOr the date or timin'\n[Chorus]\n'Course I'm lyin'\nI don't know why they ain't turned pack yet\nBut 'course we're tryin'\nI don't know that dinger or what's on the clock yet bro\nBut 'course it's mileage\nInterview room, I dont know what I done yet\nEach and every time, 'course I'm silent\nI'm a product of my environment\nSo my music, 'course it's violent\nI don't even know why my shows get locked yet\nBut 'course it's Trident\nBro's beefin' I don't even know if he's right or wrong\nYet 'course I'm riding\nLong as my OF's lively, beef ain't dying, 'course its fryin'\n(Aye, aye)\n\n[Verse 2]\nOpp block settings, dressed all sporty\nShoot straight, I don't air it in my Air Jordans\nOpp boys going on the net, going talky\nI ain't tryna hear it, them man informers\nLiving life on the fast lane\nFrom kway-kway we been cuttin' them corners\nTell bro-bro get some new smoking dingers\nWhen we bruck down this corner\nT house settings, skeng in my workers face\nSo they tryna be koalased\nPrimary school days it was astroturfs\nNow we can do kick ups in Pradas\nReally take these risks\nBeen doin' up field, no farmer\nThese old timers ain't on nuttin'\nThey fell off, Jamie O'Hara\nGot this bad B from Ghana\nTop floors, calamari for starter\nI gotta stay humble\nThere's times that I paid a few pens for a charger\nYou ain't ever done twenty eight days in the T\nStill feelin' like you've gotta go harder\nScrape that shit so hard, swear I nearly broke that Pyrex\nAnd yes it was four whole months on basic\nI swear it nearly broke my mindset\nBeen jail three times, I don't know how I'm out here\n'Course I'm tired\n(I don't even wanna risk my freedom\nAhh, it's mad)\n\n[Chorus]\n'Course I'm lyin'\nI don't know why they ain't turned pack yet\nBut 'course we're tryin'\nI don't know that dinger or what's on the clock yet bro\nBut 'course it's mileage\nInterview room, I dont know what I done yet\nEach and every time, 'course I'm silent\nI'm a product of my environment\nSo my music, 'course it's violent\nI don't even know why my shows get locked yet\nBut 'course it's Trident\nBro's beefin' I don't even know if he's right or wrong\nYet 'course I'm riding\nLong as my OF's lively, beef ain't dying, 'course its fryin'\n(Aye, aye)\n\n[Outro]\nM1OnTheBeat\nM1OnTheBeat""]",47.0,2018-11-16,m1onthebeat m1onthebeat bro beat next ain't tell that’s normal step metal that's daily fail that’s bro-bro opp block took selfies presence known even know us get scoreboard back hand grip black blade ching mans head leave swollen i'm station like 5am like five am's mans spoken many times gangdem denied splashings like five morning? crack dawn barely know i'm still yawnin' really things talk gang ain’t fall still pree 4 .44 long nuttin’ baddest b's cats fiends plugs call log step ah nearly long don’t even care sawn-off tracksuit chinos polos feds want system solar bad b visit hall i'm like 'oh lard’ got boner wanna know day come home know feels like go back forth lawyer cah tell day got court know opp road got caught date timin' 'course i'm lyin' know ain't turned pack yet 'course we're tryin' know dinger what's clock yet bro 'course mileage interview room dont know done yet every time 'course i'm silent i'm product environment music 'course violent even know shows get locked yet 'course trident bro's beefin' even know he's right wrong yet 'course i'm riding long of's lively beef ain't dying 'course fryin' aye aye opp block settings dressed sporty shoot straight air air jordans opp boys going net going talky ain't tryna hear man informers living life fast lane kway-kway cuttin' corners tell bro-bro get new smoking dingers bruck corner house settings skeng workers face tryna koalased primary school days astroturfs kick ups pradas really take risks doin' field farmer old timers ain't nuttin' fell jamie o'hara got bad b ghana top floors calamari starter gotta stay humble there's times paid pens charger ain't ever done twenty eight days still feelin' like gotta go harder scrape shit hard swear nearly broke pyrex yes four whole months basic swear nearly broke mindset jail three times know i'm 'course i'm tired even wanna risk freedom ahh mad 'course i'm lyin' know ain't turned pack yet 'course we're tryin' know dinger what's clock yet bro 'course mileage interview room dont know done yet every time 'course i'm silent i'm product environment music 'course violent even know shows get locked yet 'course trident bro's beefin' even know he's right wrong yet 'course i'm riding long of's lively beef ain't dying 'course fryin' aye aye m1onthebeat m1onthebeat,2.432017543859649,1.8729824561403507,2.4599999999999995
